<!ELEMENT konyvek (konyv*)>
<!ELEMENT konyv (cim, kiadasi_ev,kiado,szerzo+,abstract*)>
<!ATTLIST konyv id ID #REQUIRED>
<!ELEMENT cim (#PCDATA)>
<!ELEMENT kiadasi_ev (#PCDATA)>
<!ELEMENT kiado (#PCDATA)>
<!ELEMENT szerzo (#PCDATA)>
<!ELEMENT abstract (#PCDATA)>
